type,text
macro,"아이 낳고 키우기 좋은 지역사회 만들기 ○ ( 논의 내용 ) 지역사회 정책의 패러다임을 출산 장려 ( 출산장려금등 ) 에서 삶의 기반을 확충하는 「 삶의 질 패러다임 」 으로 전환 * * 지역 정책의 성 평등 관점 투영, 지자체와 저출산위 공동포럼 개최 - 현행 출산장려금 등 일회성 비용 지원 방식에서 아동 의료비경감, 돌봄서비스 확충 등 육아하기 편리한 지역사회 조성방안논의 * 예 : 지역 내 주민자치센터, 도서관 등 공공 유휴 인프라 활용, 지자체 ․ 민간과협업하여 지역 내 자생 정주할 수 있는 여건 마련에 투자 ○ ( 향후 계획 ) 시범사례 * 발굴 분석 ( ‘ 19 ), 관계부처 합동 지역사회내민간과 연계한 시범사업 진행 평가 ( ’ 20 - 21 ), 전국 확산 ( ‘ 22 ) * ( 광주 ) 마을육아플랫폼 ‘ 마을 아이 ’, 광산구 아파트 조식서비스 등"
macro,"활력있고 건강한 고령사회를 위한 사회적 기반 마련 ○ ( 논의 내용 ) 연령에 따른 제약을 극복하고 활기차게 나이 들어가며, 세대 간 相 生 할 수 있는 새로운 고령사회를 위한 기반마련 - 기대수명 ․ 고령인구 증가, 사회적 부양부담 급증에 따른 재정적자위험 등을 종합적으로 고려, 노인연령 관련 제도 틀 보완추진○ ( 쟁점 ) 정년연장 등 관련 이슈들은 자원재분에 대한 세대 간갈등을유발할 뿐 아니라 기존 고령층의 반발도 우려 - 획일적 ‘ 연령기준 조정 ’ 에서 ‘ 연령에 얽매이지 않는 사회 ’ 로 관점전환○ ( 향후 계획 ) 관계부처 협의를 거쳐 검토사항별 연구 과제선정, 연구 추진 ( ‘ 19 ) 후 개선방안 마련 ( ‘ 20 )"
macro,"□ ‘ 개인 ’ 의 삶의 질 제고에 초점 ㅇ 개인을 노동력 ‧ 생산력의 관점에 기반한 ｢ 국가 발전 전략 ｣ 에서개인의삶의 질 제고 전략으로 전환 - 사회구성원 개개인들이 유아기부터 노년기까지 삶의 경로를순조롭고 유연하게 이행할 수 있는 사회적 환경 조성에 중점ㅇ 모든 국민이 생애 주기에 따른 개별화된 삶의 권리를 보장받음으로써 「 모든 세대가 함께 행복한 지속가능 사회 」 를 구현한다는 비전하에, - ‘ 개인의 삶의 질 향상 ’, ‘ 성평등하고 공정한 사회 ’, ‘ 인구변화대응 사회 혁신 ’ 이라는 목표상 설정"
macro,개인과 부부가 속한 문화적 · 제도적 환경이 그들의 출산 결정에 미치는 영향에 관한 방대한 연구가 존재한다. 여기서'경제 대 문화'라는 이분법적 구분이 확인된다. 거시적 차원의 출산율 차이는 단순히'경제'와'문화'만으로 설명되지 않는다.
macro,"거시적 접근은 거시적 수준의 경제적, 사회적, 문화적조건과 출산율 간의 관계에 초점을 맞춘다. 여성 노동시장 참가율과 출산율 간의관계 ( Engelhardt, and Prskawetz, 2004 ; Engelhardt and Prskawetz, 2004 ), 인간개발지수 ( HDI ) 와 출산율 간의 관계 (, Kohler and Billari, 2009 ) 등이 이러한 사례에 속한다."
macro,"본 연구에서 거시적 사회 환경은 사회구조, 문화, 정책 등을 포괄하는 것으로 선행연구 고찰 결과를 토대로 교육, 노동시장, 주택, 보건, 보육, 문화 ( 양성평등, 가족가치관 ) 등을 포함한다."
macro,"보육료 지원, 가족수당 지급 등의 금전적 지원정책이 출산에 미치는 영향을 거시 자료를 이용하여 분석한 해외 선행연구는 대체적으로 양의 영향을 미치지만 효과의 크기는 제한적이라는 결과를 제시하였다. 예를 들면, D ’ Addio and d ’ Ercole ( 2005 ) 과 Luci and Thevenon ( 2011 ) 은 현금급여 및 세제지원을 통해 가구의 가처분소득이 10 % 증가할 때 합계출산율 이 0. 02 % 증가한 것으로 추정하였고, Gauthier and Hatzius ( 1997 ) 는 가족수당 25 % 증액의 출산율 증대효과를 0. 6 % 로 추정하였다. Mork et. al ( 2009 ) 의 경우 스웨덴의 보육개혁 ( 2001 ) 이 가져온 보육비용 감소로 인하여 출산율의 4∼6 % 증가효과를 제시하였다."
macro,"□ 가족지원 투자와 사회구조적 혁신의 균형적 접근과 실천 ㅇ 핵심 정책에 대한 과감한 투자를 통해 미래를 준비하는 청년층과아이를 키우는 부모의 정책 체감도를 획기적으로 제고 - 육아부담 완화를 위한 가족지원 투자는 지속적으로 확대 * 가족지원 투자를 장기적으로 OECD 평균 수준 ( GDP대비 2. 4 % ) 까지 확대노력 - 일자리ㆍ주거 등 청년층이 직면한 구조적 문제에 대한 대책강화 사회 구조적 문제에 대한 보다 강도 높은 정책적 지원과사회각 분야의 실천을 통해 생애주기의 순조롭고 유연한 이행지원 - 양성평등 육아, 일 ‧ 가정 양립, 노동시장 개혁, 교육 시스템개혁, 노동시장의 성평등 구현 등 구조적, 문화적 대책의 추진력제고"
